Product Name,Product Category,Review Source,Review Headline,Review Text,Review Rating,Review Author,Review Date
b'Dell UltraSharp 2007FP',b'Monitors',CNET,b'Dell UltraSharp 2007FP review:\xc2\xa0Dell UltraSharp 2007FP',"b''b""Dell gets just about everything right with the UltraSharp 2007FP. The $539 price is competitive, and the combination of ergonomic design, chic good looks, and practical extras is sure to please home and business users alike. Many more-expensive 20-inch LCDs, such as the Samsung SyncMaster 204T and the HP LP2065 offer similar adjustability and performance, but both monitors lack the variety of inputs and the low cost of the Dell UltraSharp 2007FP. For identical features in a wide-screen format, check out our review of the Dell UltraSharp 2007WFP.\n\nThe 20.1-inch Dell 2007FP features the same two-tone color scheme and attractive, versatile design as other members of the UltraSharp family. A  thin, black bezel frames the screen, and a slim neck extends from a Y-shape base. This design offers exceptional flexibility, with 45 degrees of swivel to the right and left and five inches of height adjustment. The panel also pivots from landscape to portrait mode and tilts 5 degrees forward and 20 degrees back. The pivoting action is a bit stiff, and the short back leg of the base makes the 2007FP a tad unsteady, but the overall merits of the design far outweigh these minor shortcomings.\n\nLined up on the 2007FP's back panel are connection ports for DVD-D, VGA, composite video, and S-Video, as well as one upstream and two downstream USB 2.0 ports and a 12-volt audio jack for connecting the optional $29 Dell Sound Bar. Two more downstream USB 2.0 ports are tucked behind the monitor's left bezel. Dell includes analog and digital cords as well as a USB cord.\n\nFive control panel buttons are clearly labeled with white-on-black icons for switching input signal and navigating the onscreen menu (OSM). Dell takes an interesting approach to its OSM layout; instead of a box in the middle of the screen, the OSM is a line of squares along the monitor's bottom edge labeled Exit, Brightness & Contrast (contrast is VGA-only), Auto Adjust (VGA-only), Input Source, Color Settings, Image Modes, Display Settings, Menu Settings, and PIP Settings. When you select a square, it brightens a little and its tiny icon changes color, but even with these cues, it's difficult to tell which option you're selecting. To complicate matters, each adjustment option has its own menu and submenu of adjustment choices to scroll through. This allows for a plethora of adjustment options, but the menus are difficult to navigate; we wish there were dedicated shortcut buttons for the most-common image adjustments, such as brightness and contrast.\n\nThe Dell 2007FP performed extremely well on CNET Labs' DisplayMate-based performance tests.  At its native 1,600x1,200 resolution, the 2007FP's text was black, sharp, and entirely legible. Grayscales progressed smoothly from deep black to bright white, with only very minor pink and green tints. The 2007FP's colors were bold and accurate, though in our color tests, red took on an orange cast and light blue appeared slightly violet, and adjusting the screen's settings didn't eliminate these errors.\n\nDVD playback on the Dell 2007FP was only average, which is not surprising, considering the 2007FP's middling 16-millisecond pixel-response rate. We noticed average amounts of digital noise and ghosting, though errors weren't excessive. Games, however, looked sharp with lots of detail in both bright and dark areas and vivid colors throughout.\n\nThe Dell 2007FP comes with an industry-standard three-year warranty and 24/7 toll-free tech support. You can buy one additional year of coverage for $29 or two years for $49.  User guides, product support, troubleshooting tips, and a Dell-hosted customer information-sharing forum are all available on Dell's Web site.\n\n""",7.8,b'Jeffrey Fuchs',"March 26, 2006 7:00 p.m. PT"
b'Asus PB278Q',b'Monitors',CNET,b'Asus PB278Q review:\xc2\xa0Great performance at a good price',"b'In the world of extreme-definition monitors, the Asus PB278Q almost perfectly hits a happy medium between features and value. I reviewed the HP ZR2740w earlier in 2012, and while that monitor offered great performance at a reasonable price, aside from brightness, customization features were nowhere to be found.'b""\n\nThe PB278Q is like getting the ZR2740w with better performance, and with a great assortment of customization features at about the same price. The Asus can't quite match the performance of the $100 more expensive Dell U2713HM and lacks the Dell's USB ports and plentiful assortment of presets, but for $100 less it's a great lower-priced alternative for those looking to save a few bucks on an extreme-definition monitor.""b""Design and features\nThe 27-inch Asus PB278Q is one of the first non-Samsung monitors to house a plane-to-line switching (PLS) panel. Previous to this, the Samsung SyncMasters S27A850D and S27B970 hold the distinction as the only other two monitors to feature the company's still relatively new panel tech. Like most monitors produced today, the PA248Q houses a white LED backlight resulting in a fairly thin, 2.6-inch deep chassis. Also, at 19.4 pounds, it's surprisingly light for a 27-inch monitor.""b""The bezel measures 0.8 inch on the left and right sides with the full width of the panel checking in at just under 25.25 inches. The 11-inch-wide footstand is the monitor's most eye-catching visual trait, measuring 11 inches by 8.6 inches. When knocked from the sides, the monitor does wobble more than I'd like. This is not too surprising when the swivel mechanism, located on the bottom on the foot stand, is taken into account, as it keeps the stand from sitting completely flat. Unfortunately, due to the awkward implementation, the entire chassis swivels when rotated, not just the screen. ""b'Speaking of which, the monitor can swivel left and right, tilt back 20 degrees, and pivot 90 degrees, and its screen height can be adjusted by about 4.5 inches. 'b'Connections include DVI, DisplayPort, VGA, HDMI, a headphone jack, and an audio-in port. The connections face downward and would be difficult to access save for the always-useful pivot feature.'b""The onscreen display (OSD) array consists of six buttons located in the lower right of the bezel on the underside of the panel and includes a preset shortcut, a Menu button, and a Source button. The buttons are separated from each other by about half a button's length of space and emit a satisfying snap when pressed.""b'Navigating the OSD feels a bit clunky, as the menu button and and preset shortcut buttons act as enter and exit button, respectively; I wish Asus could have found a less confusing way to implement its OSD controls. The OSD features Standard, sRGB, Scenery Mode, and Theater Mode presets, plus one additional customizable User Mode. Also included are brightness, contrast, saturation, hue, gamma, and advanced color settings, among which are six-color hue and saturation adjustment controls and direct RGB color control using gain and offset. Rounding out the more useful options are sharpness, aspect ratio control, picture-in-picture (PIP) settings, and system setup options such as OSD window placement and duration onscreen.'b""By far the most unusual feature in the PA248Q's already considerable assembly of OSD options is QuickFit. QuickFit places an overlay on the screen of your choice of either grid patterns (of various units of measure) or paper and photo sizes. With the grid patterns you can more precisely and consistently organize content on a page when, say, designing graphics for the Web.""b""The paper and photo sizes would show exactly what papers and photos would look like once printed. This one seems less useful, as any self-respecting graphic artist would probably already be using Photoshop or some other program to do this. Still, it's a unique option that some will get more use out of than others.""b'\n'b""Performance\nI tested the Asus PB278Q through its DisplayPort input, connected to a Windows 7 PC, using the included DVI cable. The display posted a composite score of 96 on CNET Labs' DisplayMate-based performance tests.\n""b""\nDisplayMate: The PB278Q displayed light gray up to level 254; 255 is considered white, and every level between it and 1 is a variation of gray, so 254 is as high as you can get. The PB278Q's performance here indicates that the display would retain its contrast ratio and likely not be prone to washing out light colors. As for dark gray, the U2713HM just barely displayed down to level 6 while still maintaining a deep black, which points to the display not being capable of retaining dark detail during dark scenes in movies. \n""b"" \n\n\n\nThe PB278Q excelled in most of our color tests, but didn't display color as accurately or as smoothly as the U2713HM, displaying more obvious jumps in color scale progression. \n""b' \nIn our Dark Screen test, I stare at a screen devoid of color in an attempt to identify spots where light from the backlight seeps through (known as \xe2\x80\x9cclouding\xe2\x80\x9d). While some noticeable light bled through the upper right corner, the PB278Q did a pretty good job at keeping unwanted light at bay and overall, the PB278Q displayed less backlight bleedthrough than the Dell U2713HM.\n'b'\nText: Black text on white looked clear, without any obvious color tint problems. Also, fonts were clearly visible down to a 6.8-point size.\n'b'\nMovies: I tested the Asus PB278Q using the Blu-ray version of ""Avatar."" The Theater preset provided a decent picture. The colors were vibrant, but the color temperature was a bit too cool and dark detail was practically nonexistent. The Standard mode fared a bit better for dark detail, but wasn\'t as vibrant. \n'",8.0,b'Eric Franklin',"Dec. 12, 2012 4:41 p.m. PT"
b'Razer Raptor 27',b'Monitors',CNET,"b'Razer Raptor 27 review:\xc2\xa0Smart, striking and a little bit silly'","b'The Razer Raptor 27, the company\'s first dip into the seething waters of the gaming display market, is the mullet of monitors: elegant business in the front; aggressive party in the back. If I had to come up with a single word to describe it, I\'d go with ""overdesigned."" It\'s strikingly stylized and a bit impractical. Its bright 27-inch, 2,560x1,440-pixel panel is quite good, and its feature set, which includes support for FreeSync and G-Sync-Compatible adaptive refresh, a wide color gamut and a 144Hz refresh rate, hits most of the right notes you\'d expect for its big $700 price tag.'b""That's on the high side, though, since you can get the just-as-terrific, albeit less fancy-schmancy, 4K Acer Predator XB273 for only $100 more. The bulk of Razer's lesser competitors hover in the $400 range.""b""The striking design is an interesting translation of Razer's black-slab laptop aesthetic, and there are some things I really like about it, like the elegant Chroma-compatible underglow. Plus, the dark gray fabric back adds to the classy vibe you don't normally get from a gaming monitor.""b""The monitor raises and lowers via channels in the back. While I love the gray fabric, I can't help but picture it covered with orange cat hair.""b""To access the connectors, you can tilt the display back 90 degrees. That kind of ease of access is a touch few monitor manufacturers think about, but which makes life so much better when you work on a crowded desktop or need to frequently get to them. You can't rotate the display, but the base rotates smoothly on a desk while still resisting sliding in any other direction.\xc2\xa0 \xc2\xa0""b""I've noticed, however, that the rubbery material it uses leaves marks on surfaces like the laminate bench it's been sitting on here in the CNET Lab -- the dock for the\xc2\xa0Viper Ultimate has the same base and the same problem.""b""But the cabling is just kind of nuts. Razer designed it to use flat, bright green cables with right-angle connectors that feed through individual channels in the back. That means if a cable is bad you need to replace it with a matching one from Razer, or suffer with a third-party flat cable that doesn't look the same, or worse, a standard cable that doesn't bend in the right ways, all defeating the purpose of the highly stylized design.\xc2\xa0""b'It tilts 90 degrees so you can get to the connectors underneath. A really, really big convenience.'b""The cables don't glide easily through the channels, so getting everything to lie properly can be a pain. While DisplayPort, HDMI, USB-C cables and a USB-A extender come in the box, there's no matching DisplayPort to Mini DisplayPort cable... which you'd need to connect to a Razer laptop, or most any laptop, to get G-Sync compatible adaptive refresh. Although it supports USB-C alt mode (DisplayPort) for connecting via USB-C, Nvidia requires the monitor be on the GPU bus for all G-Sync variable refresh, but USB-C is on the internal GPU/CPU bus.""b'The cabling design is kind of high-maintenance. But the underglow on the base is cool.'b""Plus, that side-by-side channel design means the base has to be huge at a time when most manufacturers are going small to conserve desk space. And I've already noticed a ding in it which I can't unsee.\xc2\xa0""",8.2,b'Lori Grunin',"Oct. 21, 2019 8:00 a.m. PT"
b'LG Flatron E2350V',b'Monitors',CNET,b'LG Flatron E2350V review:\xc2\xa0LG Flatron E2350V',"b""The LG Flatron E2350V is essentially LG's version of the Samsung SyncMaster XL2370: a thin, 23-inch monitor, with an LED backlight and a minimalist aesthetic design. The E2350V is sleek, although not quite as stylish or unique-looking as the XL2370 or its updated version, the Samsung PX2370, which both stand out thanks to their transparent necks. The E2350V has great games performance, on par with the XL2370 and PX2370; however, the PX2370 has a slight performance edge in movies, because of a seemingly deeper color gamut. Thanks to its black-level control feature, the E2350V has a lower black level than either Samsung monitor, but unfortunately, it also has a dimmer screen than the two. \n""b"" \nThe E2350V's trump card is its lower, $280 price. That's $20 less than the XL2370 and $30 less than the PX2370. The E2350V also has unique features like an ambient light sensor and a headphone jack. If you're looking for an LED monitor, go with the PX2370 because of its superior performance. If price is a concern, however, you can't go wrong with the E2350V. It has the performance, features, and the looks to make it well worth its price.\n""b""\nDesign and features\nThe 23-inch LG Flatron E2350V looks like it was modeled directly after the Samsung SyncMaster XL2370. Both monitors have similarly thin profiles, with virtually the same physical dimensions; however, with its transparent neck and edges the XL2370 has an aesthetic flare the E2350V can't match. The Flatron E2350V's panel depth measures 0.65 inch, which is slightly more than the XL2370's considerably thin 0.6-inch depth. The Flatron E2350V's bezel measures 0.9 inch, which is shorter than the XL2370's 1.1-inch. The full width of the Flatron E2350V is 22 inches, and that's about the same as most 23-inch monitors. The Flatron E2350V's screen has a matte finish and its glossy, black neck is similarly curved like the XL2370's. The oval-shaped footstand measures 9.9 inches wide and 8.4 inches deep. Although the display wobbles considerably when knocked from the sides, we don't think it's in any great danger of toppling over, given the well-designed distribution of its light, 7.38-pound weight. The bottom of the bezel sits 2.8 inches from the desktop, about the same as the XL2370. \n""b"" \nLike the XL2370, the screen height isn't adjustable and there aren't screen-rotation or pivot options for portrait mode. The capability to tilt the screen back 10 or 90 degrees is its only included ergonomic feature. The Flatron E2350V's connection options include DVI-D, HDMI, and VGA, and a headphone jack. All connections sit on the back in the lower midsection of the panel and face backward, instead of down like on most monitors, making them easy to access. \n""b' \nThe Flatron E2350V includes an onscreen display (OSD) array in the lower-right-hand side of the bezel, with the power button to the right of the array. The power button resides above a cool-looking grayish-white LED stripe, and each OSD button is denoted with a small LED dot of the same color. Touching any of the dots brings up the OSD, with each dot perfectly aligned to the onscreen option of the OSD. The array consists of six different buttons: Menu, Smart+, F Engine, Auto, Input, and Exit. With each new menu screen, the buttons alter their function, acting instead as the ""up,"" ""down,"" or ""previous menu"" buttons, making navigating the menu a simple endeavor.   \n'b"" \nPressing the Menu button allows you to navigate through Brightness, Contrast, and Sharpness controls. LG also includes a Black Level control--which includes two settings: low and bright--that affords the E2350V a lower black level than most monitors have. The OSD also includes controls for color temperature--including individual RGB controls--gamma control, a volume control for the headphone jack, and an ambient light feature called Auto Bright that adjusts the display's brightness depending on the amount of ambient light in the room. Presets include Standard, Movie, Game, and Sports. Each preset provides a preview of its settings, by dividing the screen in half: on the left is what it's currently set to, and on the right is what it could look like with the preset.\n""b'  \nThe LG Flatron E2350V\'s 16:9 aspect ratio supports a ""Full HD"" native resolution of 1,920x1,080 pixels. This continues the trend of more and more monitor vendors moving toward 16:9 from 16:10 because high-definition content--in particular 1080p movies--can fit onto a 1,920x1,080-pixel screen in full-screen mode without stretching the image.\n'b'\n\n'b""\nPerformance\nWe tested the LG Flatron E2350V with its DVI connection. The display posted a composite score of 94 on CNET Labs' DisplayMate-based performance tests, just below the XL2370's 96, and the PX2370's 97. Thanks to its black-level control feature, the LG Flatron E2350V demonstrated a low black level in our grayscale tests; lower even than the PX2370. However, the E2350V and the PX2370 allowed virtually the same amount of light through their respective screens in our dark-screen test. The PX2370 seemed to have a larger color gamut as evidenced by our color scales test, where the LG Flatron E2350V didn't distinguish between similar colors as well as the PX2370 did. Overall, the two monitors performed similarly in DisplayMate, with the PX2370 getting a slight edge, especially in color tests. \n ""b"" \nThe LG Flatron E2350V achieved a brightness score of 197 candelas per square meter (cd/M2), much lower than the XL2370's 344 cd/M2 and still lower than the PX2370's 246 cd/M2. However, thanks to its low black level, the Flatron E2350V had a much higher tested contrast ratio of 1,355:1, compared with the 1,008:1 and 948:1 of the XL2370 and PX2370, respectively. \n ""b' \nWe used the LG Flatron E2350V\'s movie preset to check out ""Kill Bill: Vol. 1"" on DVD and a number of 1080p movie files from Microsoft\'s WMV HD Showcase. In both ""Kill Bill"" and the 1080p movies, we found that the PX2370\'s more accurate and vibrant color surpassed the LG Flatron E2350V\'s color quality. In a side-by-side comparison, red on the LG Flatron E2350V looked closer to orange when compared with the deeper red we saw on the PX2370 in the same scene.\n '",7.7,b'Eric Franklin',"May 12, 2010 10:35 p.m. PT"
b'Samsung CF791',b'Monitors',CNET,"b""Samsung CF791 review:\xc2\xa0Samsung's big-screen gaming champ for AMD Radeon fans""","b""I have enough ambivalence about curved monitors to fill a 34-inch screen. For games? No question it's good. For movies and work, though, it gives pause. Most movies use a 16:9 or 16:10 aspect ratio so at best they float in the middle of a 21:9 screen. And, for example, you can comfortably fit three windows side by side, but if you only need two neither one is directly in front of you -- you're staring at the space between them. ""b'Keeping those caveats in mind, the 34-inch Samsung CF791 (the C34F791WQN, to be precise) is an excellent option in this class. 'b""It's great for gaming, with sufficiently fast response times, a solid AMD FreeSync implementation (with a 100Hz max refresh, you've also got some leeway on lower-power Nvidia GPUs), vivid colors and a reasonable amount of configuration flexibility. Field of view, people. ""b""It's not cheap, but I don't think its $950 price tag is unreasonably high for what it offers. In the UK it costs \xc2\xa3800. I don't see it offered in Australia, at least not yet (for reference, the US price directly converts to AU$1,050). Samsung also offers a less-expensive display -- Samsung prices it higher but it has a lower street price -- the SE790 (technically, the LS34E790CNS). However it doesn't support FreeSync or use the company's Quantum Dot technology, and it's less curved. ""b""Setting it up is dead easy, mostly because the stand is integrated. It rises or lowers as it slides along a track that simultaneously tilts it. In other words, at its highest, you're viewing it directly ahead. At its lowest, it tilts back so you're looking down at it. You can adjust the amount of tilt, giving it a cockpit feel that's a comfortable way to give your neck and upper back a change. It's probably a really good fit for standing desks. ""b""You can configure the HDMI and full-size DisplayPort inputs to display simultaneously in Picture-in-Picture or Picture-by-Picture modes, and there's an HDMI out for passing the signal through to another monitor or TV.\xc2\xa0 ""b""Since they're positioned on the left side and not blocked by the arm, the connectors are really easy to reach. And while I'm not crazy about the white and silver, it's much easier to read the connection labels than with many of the dark cabinets. ""b'I also like Samsung\'s single-control joystick design for navigating the onscreen display and options. But it means there\'s no way to map custom presets or FreeSync modes for direct access. The Samsung Magic Bright ($41 at Best Buy) setting actually refers to its preset modes rather than brightness, and its ""Basic"" mode is sRGB. In fact, there\'s a lot of ambiguity in the OSD: Gamma choices are Mode1, Mode2 and Mode3, for example. But there\'s a respectable set of options, including dynamic contrast, HDMI black level (which I believe is necessary to compensate on Quantum Dot panels). Magic Upscale basically oversharpens everything.'",8.3,b'Lori Grunin',"July 9, 2017 5:43 p.m. PT"
