Product Name,Product Category,Review Source,Review Headline,Review Text,Review Rating,Review Author,Review Date
b'Asus PA248Q',b'Monitors',CNET,b'Asus PA248Q review:\xc2\xa0Asus PA248Q',"b"" The Asus PA248Q doesn't quite match last year's PA246Q in performance, but that's to be expected. The PA246Q sported a more expensive panel capable of displaying more colors.""b""The trade-off? The PA248Q is much less expensive (at least $170 less) and, thanks to its more eco-friendly LED backlight, uses less power. Also, unless you're a graphics professional, you likely won't notice the PA248Q's color deficiency. The PA248Q has the same great connections and ergonomic features as its predecessor and even manages to fit in an unprecedented level of USB 3.0 support.""b' 'b""Design and features Editor's note: The PA248Q is so close in design to the PA246Q that much of the design and features section of that review is used here.""b'In the top-left corner of the 24-inch Asus PA248Q\'s chassis, written in white text, is the word ""ProArt."" If there was any ambiguity about the type of user Asus is targeting with this monitor, this small design touch should abolish it. However, while most ""Pro"" monitors, like 2011\'s PA246Q, house an aptly named Professional In-Plane Switching (P-IPS) panel, the PA248Q uses an Enhanced IPS (E-IPS) panel. In my experience, E-IPS panels typically perform worse than their P-IPS brethren in color reproduction, but we\'ll get to that later. The PA248Q houses an LED backlight as opposed to the PA246Q\'s Cold Cathode Fluorescent Lamp (CCFL) backlight. The result is a body that is considerably thinner than the PA246Q\'s, measuring a full 2.4 inches deep, compared with the older monitor\'s girthy 3.2 inches. Also, at 14 pounds, the PA248Q is 3 pounds lighter than the older model.'b""The bezel measures 0.75 inch on the left and right sides with the full width of the panel checking in at just under 22 inches. Aligned along the bezel are the rulerlike measurement notches last seen on the PA246Q. This precision motif continues at both the base and top of the display's neck, where two circular dials reside with measuring notches arranged along their perimeters. The dials act as measurement guides and make precise swiveling and pivoting of the panel possible.""b' 'b'Speaking of which, the monitor can swivel 60 degrees left and right, tilt back 20 degrees, and pivot 90 degrees, and its screen height can be adjusted by about 4 inches. The foot stand is fairly flat, and squarish in shape, measuring 11 inches wide by 9.25 inches deep. When knocked from the sides, the display wobbles a lot when at its full height, but hardly at all when adjusted to its lowest.'b""Along the monitor's left edge, aligned vertically, are four USB 3.0 downstream ports; the multimedia card reader from the PA246Q has been removed. Back connections include DVI, DisplayPort, VGA, HDMI, USB 3.0 upstream, and a headphone jack. There's also a power switch, tucked away on the right side. The connections face downward and would be difficult to access save for the always-useful pivot feature.""b'The onscreen display (OSD) array consists of six buttons: a small ""joystick"" nub, two function shortcuts, a preset shortcut, a Menu button, and a Source button. The buttons are separated from each other by a button\'s length of space and emit a satisfying snap when pressed.'b""You can navigate the OSD with the joystick, but its usefulness is limited. The stick can be used to scroll up and down menus, but you must use the menu button to back out of menus, which feels counterintuitive. Here's hoping Asus will add more functionality to the joystick in the monitor's next iteration. The OSD features Standard, sRGB, Scenery Mode, and Theater Mode presets, plus two additional customizable User Modes. Also included are brightness, contrast, saturation, hue, gamma, and advanced color settings including six-color hue and saturation adjustment controls and direct RGB color control using gain and offset. Rounding out the more useful options are sharpness, aspect ratio control, picture-in-picture (PIP) settings, and system setup options such as OSD window placement and duration onscreen.""b""By far the most unusual feature in the PA248Q's already considerable assembly of OSD options is QuickFit. Pressing in the joystick nub places an overlay on the screen of your choice of either grid patterns (of various units of measure) or paper and photo sizes. With the grid patterns you can more precisely and consistently organize content on a page when, say, designing graphics for the Web.""b""The paper and photo sizes would show exactly what papers and photos will look like once printed. This one seems less useful, as any self-respecting graphic artist would probably already be using Photoshop or some other program to do this. Still, it's a unique option that some will get more use out of than others.""b' 'b""Performance We tested the Asus PA248Q through its DVI input, connected to a Windows Vista PC, using the included DVI cable. The display posted a composite score of 92 in CNET Labs' DisplayMate-based performance tests.""b""DisplayMate: The Asus PA248Q displayed light gray up to level 253 (pure white is 255), but level 254 was indistinguishable from white. At the lower end of the grayscale, the monitor succeeded in showing dark gray down to a level of only 4 (black is 0); lower than the PA246Q, which only got as low as 6. This indicates that although very light gray could elude the PA248Q in movies and games, it's still capable of retaining some dark detail. ""b'In Color Tracking I noticed a slight red hue in the grayscale when using the Standard preset. Switching to User Mode 1 allows you to adjust the red downward, however. '",8.0,b'Eric Franklin',"July 30, 2012 4:53 p.m. PT"
b'Dell UltraSharp 2408WFP',b'Monitors',CNET,b'Dell UltraSharp 2408WFP review:\xc2\xa0Dell UltraSharp 2408WFP',"b""\nThe  may be cheaper, but the Dell UltraSharp 2408WPF display is the better value of the  two \n\n24-inch LCD monitors. It  performed outstandingly in our labs-based DisplayMate tests, delivering quite \n\npossibly the best image we've seen for DVD playback. The 2408WPF packs all of its stellar performance inside \n\na practical and aesthetically pleasing design while delivering an embarrassment of connection riches. \n\nMoreover, it carries a fair price of $599; we'd wager any 24-inch display you find for less will come with \n\ntrade-offs in terms of features or performance or both. The UltraSharp 2408WFP is a great entertainment \n\ndisplay, whether it is games, DVDs, or--making use of its 1,920x1,200 resolution--HD movies. Rest assured, it \n\ndoes not drop the ball on the basics; we give it a strong recommendation should you seek a large productivity \n\nmonitor. \n""b'\nDesign\nThe Dell 2408WFP shares the same basic design as its predecessor, the UltraSharp 2407WFP. This includes the relatively \n\nthin bezel around the edge of the screen with the Dell logo along the bottom. \n'b'\nThe onscreen display is easy to navigate and includes the usual options of brightness, contrast, color, and \n\nso on. We also liked that the OSD stays on the screen long enough to evaluate any changes you make while \n\ncalibrating the display. There are also six included preset modes for activities such as playing games, \n\nwatching movies, and graphics work that affect color temperature, contrast, and brightness. \n'b""\nFrom the back, you're looking at a mostly silver enclosure, which runs along the foot and neck of the stand \n\nwith a large silver Dell logo at the top. The screen rotates 45 degrees to the left and right, and about 30 \n\ndegrees back. The screen also pivots 90 degrees to the left into portrait mode, but you'll have to rotate the \n\nscreen back first before you can actually pivot it as the stand is in the way normally. This is a minor \n\ngripe, but it's something we hope Dell will consider when they choose to redesign this chassis. \n""b'\nThe foot of the stand is the same Y-shaped, or ""bird-foot"" as it is sometimes called, design as found on last \n\nyear\'s model. The width of the stand is about 15.5 inches at its widest and really helps to make the display \n\nfeel very sturdy, even when placed on a narrow stand and the screen is raised to the top of its 4.5-inch \n\nrange. This display has many connection options, and Dell continues to make it easy to find them all. Each \n\nconnection has a very clear illustration beneath it that makes it a cinch to find and connect.\n'b""\nManufacturer's specs:\nResolution: 1,920x1,200\nPixel-response rate: 6ms\nContrast ratio:  3000:1 (Dynamic) \nConnectivity: DVI, VGA, HDMI, component, composite\nHDCP compliant? Yes\nIncluded video cables? VGA, DVI, HDMI\n""b""\nFeatures\nThe Dell UltraSharp 2408WFP includes an abundance of connection options. For video connections, you'll find a \n\nVGA, two DVI, an HDMI, a DisplayPort, component, and composite ports. There's also a speaker port, four USB \n\nports (plus one upstream USB port), and a media card reader for Compact Flash and SD formats. That's \n\ncertainly a long list of connections, but if we're being greedy, we would have liked to have seen an optical \n\naudio out connection. Compared with the lower priced Gateway FHD2400 we reviewed recently and praised for its \n\nconnection options, the Dell surpasses it in the variety and volume of connection options. In particular, the \n\nextra DVI port and the DisplayPort are valuable extras if you want to connect the display to a media center \n\nor high-end PC.\n""b""\nThe Dell has a Dynamic Contrast of 3000:1. This means--according to Dell--that the blacks the display outputs \n\nare three times darker than the whites are when viewing dark scenes. To get that kind of contrast ratio the \n\ndisplay powers down its backlight in dark scenes, so that the blacks are very dark. This also means that if \n\nthe dark scene in question contains areas of bright light, the light may be sacrificed as the backlight does \n\nnot have the power to represent it accurately. Basically, Dynamic Contrast is just a marketing term and, for \n\nnow, there is no independent standard for measuring it, so it should not be considered when making a buying \n\ndecision. We felt the display was capable of dark blacks, but they could have been a bit darker. The whites \n\nwere as bright as any we've seen in a recent display. \n""b'\nPerformance\nWe tested the Dell UltraSharp 2408WFP through the DVI connection and it delivered high scores across the \n\nboard in our labs-based DisplayMate tests, excelling \n\nparticularly in sharpness and color. Most monitors have no problem displaying legible fonts at 6.8 point and \n\nabove, but things usually deteriorate as the size gets smaller. At 6 point, most displays have a hard time \n\nwith sans serif fonts such as Helvetica, because of the somewhat curvy nature of the font. The Dell is not \n\nimmune to this issue completely, but it performed better here than the Gateway FHD2400. The Dell rendered the \n\nfonts thinly, unlike the Gateway where the fonts seemed fat, oversaturated, and less distinct in comparison. \n\nIts composite score of 90 on our DisplayMate suite of tests has been matched only by another Dell display, \n\nthe 22-inch SP2208. \n'b'\n\n'b'\n\n'",8.7,b'Eric Franklin',"April 16, 2008 9:02 p.m. PT"
b'Samsung SyncMaster P2770HD',b'Monitors',CNET,b'Samsung SyncMaster P2770HD review:\xc2\xa0Samsung SyncMaster P2770HD',"b""\nThe 27-inch Samsung SyncMaster P2770HD is a larger version of the P2370 that we reviewed last year.  It's essentially an HDTV that can double as a monitor. It has nearly all the TV connections you'd expect and even comes with a fully functioning remote control. It can be found at major online stores for about $430, which is not a bad price considering it's essentially a 27-inch HDTV. While its movie playback performance is hampered by a slight greenish tint and its clouding is very apparent on dark screens, the P2770HD has solid overall performance that stands up well to some of the best monitors we've seen, such as the XL2370 or the larger 27-inch HP 2709. \n ""b""\nDesign and features\nThe 27-inch Samsung SyncMaster P2770HD is a larger version of the P2370HD that we reviewed. The panel measures 2.5 inches in depth and  26.3 inches in full width, compared with the Dell UltraSharp U2711's much greater depth of 3.4 inches and larger 25.4-inch width. The Samsung's bezel measures 1.3 inches on the sides and 1.9 inches on the bottom where a light-gray Samsung logo resides. On the edge of the bezel is a plastic transparent overlay. As different colored light passes through the overlay, it gives the impression that the display is changing color. The screen has a slightly frosty matte finish and the neck of the display shares its design with the P2370HD and XL2370, which is still one of the most aesthetically interesting designs we've seen. The neck is made of transparent glass without the bluish crystals found on the P2370 and XL2370. However, the lack of blue crystals diminishes the aesthetic interest of this display. The bottom of the bezel sits about 3 inches from the desktop, but unfortunately, the screen height isn't adjustable and there isn't a screen rotation or pivot option for portrait mode. The capability to tilt the screen back 25 degrees is the monitor's only ergonomic feature. The oval-shaped footstand is 12.5 inches wide by 9.8 inches deep, but even with such a wide footstand, the display wobbles and slides considerably. However, the display only felt unstable with the screen tilted back to its fullest.\n ""b""\n\nThe P2770HD's connection options include one HDMI port, a VGA port, a DVI port, a component port, a composite port, and a coaxial connection for an antenna or cable. Also, there's a port for normal audio and a digital audio out. All of the ports are on the back  of the display in the lower right-hand side of the panel and face backward. This style of placement makes each connection easy to access; however, there is a headphone jack poorly placed back here, too. Above the connection options are four screw holes for mounting the display to the wall, VESA-style, though you'll have to supply your own mount.\n ""b""\n\nPressing your finger against the bottom right-hand corner of the bezel brings up the hidden onscreen display button array. The red, glowing buttons disappear after a couple moments without activity. The array consists of a Menu button, an Up and Down button, an Enter button, and a Plus and Minus button; however, the OSD is best navigated with the included remote control. We found navigating the Samsung's menu a less efficient experience than with other TV-like monitors, such as the LG Flatron M237WD. While changing the audio to SRS TruSurround took four steps on the Samsung, doing the same on the LG only took three steps. The options function very much like a typical HDTV. The Picture option includes controls for brightness, contrast, sharpness, and color temperature. Audio options for the built-in speakers include TruSurround--which simulates having a 5.1 or larger surround sound system--and a number of presets for movies, music, and so on.\n ""b""\n\nOur in-lab cable box is a bit dated and doesn't have  an HDMI port.  So we attached the monitor via a component cable to the box and watched a little HD cable programming. We found that the Samsung has a consistently high-quality picture. Again, we did not have an opportunity to test this with HDMI.\n ""b'\n\nThe Samsung SyncMaster P2770\'s 16:9 aspect ratio supports a ""Full HD"" 1,920x1,080-pixel native resolution. This continues the trend of monitor vendors moving toward 16:9 aspect ratio from 16:10 ratio because high-definition content--in particular 1080p movies--can fit onto a 1,920x1,080-pixel screen in full-screen mode without stretching the image.\n 'b""\nManufacturer's specifications:\nResolution: 1,920x1,080\nPixel-response rate: 5ms\nContrast ratio: 1,000:1\nConnectivity: HDMI, DVI-D, VGA, component, composite\nHDCP compliant? Yes\nIncluded video cables? DVI, HDMI\nBrightness: 300 cd/m2\nBacklight: CCFL\nPanel Type: TN\n""b""\nPerformance\nWe tested the Samsung SyncMaster P2770HD with its DVI connection. The display posted a composite score of 94 on CNET Labs' DisplayMate-based performance tests, coming in a few points lower than the other 27-inch monitor we tested recently, the Dell UltraSharp U2711. In our Dark Screen test, clouding, or backlight bleed through, was noticeable on the top and especially the bottom middle edge of the screen. Also, we noticed a slight greenish tint in our Color Tracking test, suggesting that there's a slight color-tracking problem. The P2770HD achieved a brightness score of 267 candelas per square meter. \n ""b'\n\nWe used the P2770\'s Entertainment preset to check out ""Kill Bill Vol. 1"" on DVD and several 1080p movie files from Microsoft\'s WMV HD Showcase. We also looked at the same movies on Samsung\'s XL2370. In both ""Kill Bill"" and the 1080p movies, we found that while the XL2370 had consistent brighter colors than the P2770HD. For example, in a skiing scene, the snow along the mountain looked slightly greenish in comparison to the XL2370\'s representation, which looked closer to white. This isn\'t an egregious difference, but one that\'s noticeable when looking carefully with both displays side by side. \n 'b'\n\nAs good as movies looked in the Entertainment preset, we found that the Dynamic Contrast preset worked best for movie watching. With Dynamic Contrast on, we only noticed the screen darkening on scenes where the screen is 90 percent black or more, such as the end credits and during fades to black. In the DC preset, blacks looked darker and the colors slightly more full.\n 'b'\n\n We looked at World of Warcraft and Unreal Tournament 3 and noticed no signs of input lag or any streaking or ghosting during fast movement. Games looked bright without the color problem we saw in movies. \n '",6.9,b'Eric Franklin',"Feb. 24, 2010 5:33 a.m. PT"
b'Alienware 55 OLED Gaming Monitor (AW5520QF)',b'Monitors',CNET,"b""Alienware 55 OLED Gaming Monitor (AW5520QF) review:\xc2\xa0Epic gaming display, but epic price doesn't add up""","b""Every now and then I review a product which both beguiles and befuddles me. The Alienware 55 OLED Gaming Monitor has been bedeviling me in that way since it landed in the office less than two weeks ago. Beguiling, because at 55 inches it's huge -- for a computer monitor, at least -- with the broad gamut, vivid colors, spectacular blacks and superfast pixel response OLED\xc2\xa0is known for. It's also a looker, in the striking Legend design system the company rolled out in early 2019. But also befuddling, because I can't make sense of it as something someone would want to buy over an alternative, like the $1,600 2019 LG C9 series, given the Alienware's $4,000 price tag. For $3,000, maybe. For $2,500, probably.""b""It may be thick on the bottom, but it's ultrathin on top.""b""It's important to understand that nothing compares to OLED for gaming. The technology wins the image-quality trifecta of contrast (because black pixels are truly black), color gamut (a minimum of over 90%\xc2\xa0UHDA P3) and color accuracy (because of its relatively pure spectral intensities). Plus its pixels turn on and off as close to instantaneously as you can get, which minimizes ghosting. Unlike most movies, games also push the limits of color, as computer graphics actually use all those maximally saturated colors at the edges of the gamut that aren't found in nature.""b""From that perspective, you just want to park yourself in front of the Alienware 55 and game until you're evicted.""b""As a monitor, the Alienware does offer some advantages over a TV like the LG. In the absence of HDMI 2.1 support -- stick a pin in that topic, for the moment -- its DisplayPort 1.4 connection is probably the biggest difference. It delivers the bandwidth necessary to support 4K at its maximum 120Hz refresh rate rather than at the usual 60Hz. (Higher refresh rates give you more headroom for synchronizing the frame rate of a game with the display, which helps avoid artifacts.) Plus, 120Hz can also make simply viewing the screen easier on your eyes than 60Hz, depending upon how sensitive you are and what you're watching. ""b'It also has familiar monitor perks, including four USB-A ports, two in an easily accessible location on the side. In this case, it gives you somewhere to stick your wireless dongles and devices with long cables.\xc2\xa0 'b'On the left side is an HDMI connector, two USB-A ports and a headphone jack.'b""Beneath the screen you'll find standard monitor controls, and it comes with a snazzy remote with two halves that snap together with magnets -- and which come apart (but don't break) when you drop it. The onscreen display's options bear more similarity to a monitor's than a TV's as well.""b""If you're familiar with Dell monitors, you'll recognize the Smart HDR modes -- in this case, game, movie, desktop and reference -- which report to Windows whether it can toggle its HDR settings. If you've chosen the game setting, Windows can enable it for games or wide-color gamut. If you want it for movies, you'll have to enable that setting instead.\xc2\xa0 ""b""The Alienware 55 next to the Alienware m15 R2 laptop. The command center software didn't recognize the monitor to control the lighting, though, so I couldn't sync them. The back panel attaches via magnets, making it easy to remove when you need to access the connections.""b'Additionally, it has various game-type presets, such as for first-person shooter and real-time strategy games. Each visibly changes the white point and gamma of the display in order to, say, increase the brightness in shadow areas. FPS changes the display most dramatically, boosting the brightness so you can make out shadow detail.\xc2\xa0'b""But I frequently found myself switching among them midgame in Borderlands 3\xc2\xa0-- to FPS when I needed shadow detail, but back to anything else afterward, because FPS made it too washed out and had a greener cast in order to boost the brightness. You won't find crosshair options; OLEDs are especially susceptible to burn in, so you wouldn't want one sitting on the screen for hours on end.""b'The Alienware 55 design matches the latest gaming gear from the company, such as the Area-51m laptop. Being an Alienware, naturally it has custom lighting, which you can set via the onscreen menus or when connected via USB.\xc2\xa0'",8.0,b'Lori Grunin',"Sept. 30, 2019 3:00 a.m. PT"
b'Dell UltraSharp U2711',b'Monitors',CNET,b'Dell UltraSharp U2711 review:\xc2\xa0Dell UltraSharp U2711',,9.5,b'Craig Simms',"Feb. 17, 2011 6:54 p.m. PT"
