Product Name,Product Category,Review Source,Review Headline,Review Text,Review Rating,Review Author,Review Date
b'Dell UltraSharp U2713HM',b'Monitors',CNET,b'Dell UltraSharp U2713HM review:\xc2\xa0The best overall monitor',"b""The Dell UltraSharp U2713HM isn't the absolute best monitor performer. And at $799, it's not the cheapest monitor, either. Yet thanks to its price-to-price and features-to-performance ratio, it's the best overall monitor currently available. ""b' It achieves this by offering a beautiful extreme definition screen resolution of 2,560x1,440 pixels, deep ergonomic support, useful screen options, and an impressive array of connections.'b""If you can spare $800, it's the monitor to get.""b"" Editors' note: The U2713HM is essentially a larger version of the U2412, with a few changes here and there. You may get a sense of deja vu if you've read both reviews.""b' Design and features ""Thin and light"" aren\'t usually descriptors assigned to 27-inch in-plane switching (IPS) monitors, but in the curious case of the Dell UltraSharp U2713HM, that\'s as apt a description of its physical attributes as I could think of.  'b'  Unlike the U2711 from 2010, the U2713HM houses an LED backlight and uses an AH-IPS panel as opposed to the H-IPS panel the U2711 utilized.  AH-IPS panels are a fairly new panel standard that purportedly provides high color accuracy while delivering lower power consumption. Check out the performance section to see how true that is in this case.'b"" The U2713UM's LED backlight affords it a much thinner design than previous entries in the series. Initially, the panel measures 0.9 inch thick. It then tapers back toward the rear where another 1.2 inches house the connection options and ventilation system. This brings its collective depth to 2.1 inches; that's 1.3 inches thinner than the U2711. At 13 pounds, again, we're seeing something uncharacteristic: a light 27-inch IPS monitor. Unexpected, since they can easily top 20 pounds.  ""b' 'b' The left and right side bezels measure 0.8 inch each, and the full panel width is 25.2 inches. The foot stand sits 12.2 inches wide and 7.9 inches deep; however, knocking the panel from the sides yields ample wobbling on a flat surface. Not a necessarily earth-shattering discovery, given its light weight.  'b""   The U2713HM sports a complete collection of ergonomic options, including a 90-degree pivot, 45-degree left and right swivel, and 20-degree back tilt. Also, there's 4.5 inches of screen height adjustment, with panel-to-desktop space measuring 1.7 inches at the bottom and 6.2 inches at the top.  ""b""   Video connections options consist of DisplayPort, DVI, HDMI, and VGA; unfortunately they face downward, not out. Connections on monitors should face out, not down, as it simply makes connecting and disconnecting cables a lot easier. Many smaller monitors achieve this, as do pretty much all TVs. It's time we started seeing them on performance monitors. That said, the pivot feature makes slightly less blood drip from my nose when connecting the monitor.   ""b' 'b' The onscreen display (OSD) array is aligned vertically along the lower-right bezel and consists of four small but well-spaced buttons. Navigating the OSD is simple and clean. Dell still makes the best-designed OSDs in the industry with a contextual navigation system that never lets you forget the function each button has at any given time.  'b""   Customizations are robust and vast, providing access to brightness, contrast, and sharpness. Its seven different presets consist of Standard, Multimedia, Movie, Game, Text, Color Temperature, and RGB (sRBG). The color temperature preset allows for altering temperature values from 5,000 Kelvin up to 10,000K. The RGB preset allows you to access red, green, and blue values individually. One minor disappointment, however, is that you can't alter color temperature or RGB values when in a different preset. You can augment both hue and saturation, though.  ""b""   For the energy conscious among you (all both of you), in the top-right corner of the OSD sits an energy-use meter that gauges how much power the monitor is using. Also, there's an Energy Smart mode that lowers the brightness based on the amount of ambient light in the room.  ""b' 'b"" Perhaps as a byproduct of being unaccustomed to such light IPS displays, it was difficult to get used to something (a well-performing IPS monitor) that felt so light and airy. In my mind, IPS monitors should be these weighty behemoths; experiencing the opposite was a bit off-putting. Admittedly, this is a crazy personal thing and doesn't really affect the monitor's quality. ""b' 'b"" Performance I tested the Dell UltraSharp U2713m through its DVI input, connected to a Windows 7 PC, using the included DVI cable. The display posted a composite score of 98 on CNET Labs' DisplayMate-based performance tests. ""b"" DisplayMate: The U2713HM displayed light gray up to level 253; 255 is considered white and every level in-between it, and 1 is a variation of gray, so 253 is nearly as high as you can get. The U2713HM's performance here indicates that the display would retain its contrast ratio and likely not be prone to washing out light colors. As for dark gray, the U2713HM just barely displayed down to level 2 while still maintaining a deep black, pointing to the display being capable of retaining dark detail during dark scenes in movies.  ""b'   The U2713HM excelled in all of our color tests, showing a propensity for displaying color accurately and smoothly with no unexpected jumps in color scale progression.  'b'   In our Dark Screen test, I stare at a screen devoid of color in an attempt to identify spots where light from the backlight seeps through (known as ""clouding""). While there was some obvious clouding along the left edge of the screen, it was thankfully confined there and didn\'t show up anywhere else.  'b' Text: Black text on white looked clear, without any obvious color tint problems. Also, fonts were clearly visible down to a 6.8-point size. 'b' Movies: I tested the Dell UltraSharp U2713HMm using the Blu-ray version of ""Avatar."" The movie preset provided a great movie-watching experience, displaying a high contrast and a vibrant look, with rich colors and appropriately deep blacks. I didn\'t notice any color over-saturation problems, but there was a slight green tint, seen especially in characters\' faces at times.'b' '",8.5,b'Eric Franklin',"Nov. 12, 2012 4:17 p.m. PT"
b'Dell UltraSharp U2412m',b'Monitors',CNET,b'Dell UltraSharp U2412m review:\xc2\xa0Dell UltraSharp U2412m',"b""As the follow-up to 2009's Dell UltraSharp U2410, the U2412m has quite a bit to live up to. I expected Dell to stay on its high-end and expensive course it had already plotted for the series. Not surprisingly, I'll admit to being a bit disappointed when I learned Dell went with a cheaper IPS panel with the 2412m compared with its previous efforts.  ""b' Design and features ""Thin and light"" aren\'t usually descriptors assigned to 24-inch In-Plane Switching (IPS) monitors, but in the curious case of the Dell UltraSharp U2412m, that\'s as apt a description of its physical attributes as I could think of.  'b'  Unlike the U2410 from 2009, the U2412m houses an LED backlight and uses an E-IPS panel as opposed to the H-IPS panel that the U2410 utilized. E-IPS panels are cheaper to manufacturer, but performance-wise, usually land between Twisted Nematic (TN) and H-IPS. Check out the performance section to see how true that is in this case.  'b""  The U2412m's LED backlight affords it a much thinner design than previous entries in the series. Initially, the panel measures 1.1 inches thick. It then tapers back toward the rear where another 1.6 inches house the connection options and ventilation system. This brings its collective depth to 2.7 inches; that's a little more than half an inch thinner than the U2410. At 13 pounds, again, we're seeing something uncharacteristic: a light IPS monitor. Unexpected, since they can easily top 20 pounds.  ""b' The left and right side bezel measures 0.7 inch each, and the full panel width is 21.9 inches. The foot stand sits 11 inches wide and 7.2 inches deep; however, knocking the panel from the sides yields ample wobbling on a flat surface. Not a necessarily earth-shattering discovery, given its light weight.  'b""  The U2412m sports a complete collection of ergonomic options, including a 90-degree pivot, 45-degree left and right swivel, and 20-degree back tilt. Also, there's 4.8 inches of screen height adjustment, with panel-to-desktop space measuring 1.3 inches at the bottom and 6.1 inches at the top.  ""b""  Video connections options consist of DisplayPort, DVI, and VGA. The lack of HDMI is disappointing, but perhaps even more disappointing is the placement of the connections that are included. Connections on monitors should face out, not down, plain and simple. Many smaller monitors achieve this, as do pretty much all TVs. It's time we started seeing them on performance monitors. That said, the pivot feature makes slightly less blood drip from my nose when connecting the monitor.   ""b' The OSD array is aligned vertically along the lower-right bezel and consists of four small but well-spaced buttons. Navigating the OSD is simple and clean. Dell still makes the best-designed OSDs in the industry with a contextual navigation system that never lets you forget the function each button has at any given time.  'b""   Customizations are robust and vast, providing access to brightness, contrast, and sharpness. Its seven different presets consist of Standard, Multimedia, Movie, Game, Text, Color Temperature, and RGB. The color temperature preset allows for altering temperature values from 5,000 Kelvin up to 10,000K. The RGB preset allows you to access red, green, and blue values individually. One minor disappointment, however, is that you can't alter color temperature or RGB values when in a different preset. You can augment both hue and saturation, though.  ""b""  For the energy conscious among you (all both of you), in the top-right corner of the OSD sits an energy use meter that gauges how much power the monitor is using. Also, there's an Energy Smart mode that lowers the brightness based on the amount of ambient light in the room.  ""b""  Perhaps as a byproduct of being unaccustomed to such light IPS displays, it was difficult to get used to something (a well-performing IPS monitor) that felt so light and airy. In my mind, IPS monitors should be these weighty behemoths; experiencing the opposite was a bit off-putting. Admittedly, this is a crazy personal thing and doesn't really affect the monitor's quality. ""b' 'b"" Performance I tested the Dell UltraSharp U2712m through its DVI input, connected to a Windows Vista PC, using the included DVI cable. The display posted a composite score of 97 on CNET Labs' DisplayMate-based performance tests. ""b"" DisplayMate: The U2412m displayed light gray up to level 254; 255 is considered white and every level in-between it and 1 is a variation of gray, so 254 is about as high as you can get. The U2412m's performance here indicates that the display would retain its contrast ratio and likely not be prone to washing out light colors. As for dark gray, the U2412m just barely displayed down to level 2 while still maintaining a very deep black, pointing to the display being capable of retaining dark detail during dark scenes in movies.  ""b'   The U2412m excelled in all of our color tests, showing a propensity for displaying color accurately and smoothly with no unexpected jumps in color scale progression.  'b'  In our Dark Screen test, we did see some light clouding in all four corners of the screen. And by ""light"" I mean ""very little."" 'b' Text: Black text on white looked clear, without any obvious color tint problems. Also, fonts were clearly visible down to a 6.8-point size. 'b' Movies: I tested the Dell UltraSharp U2412m using the Blu-ray version of ""Avatar."" The movie preset provided a great movie-watching experience, displaying a high contrast and vibrant look with rich colors with appropriately deep blacks. No oversaturation or green tint problems were noticeable.   'b"" Games: When evaluating the look of games on a monitor, the two most important features to consider are vibrancy and color. If the monitor can display games with a bright and vibrant cleanness, this goes a long way toward benefiting its looks. If colors can also pop with fullness and depth, games can usually look great. Streaking is a different concern that honestly isn't very pervasive with most modern monitors, but if you're concerned about it, be sure to check out the last paragraph in this section.  """,8.0,b'Eric Franklin',"March 2, 2012 3:09 a.m. PT"
b'Apple Pro Display XDR',b'Monitors',CNET,b'Apple Pro Display XDR: Grading on a curve',"b""The Pro Display XDR, Apple's 32-inch 6K display.""b'After waiting for what felt like forever for the Apple Pro Display XDR to arrive, it finally dropped out of the sky and on to my test bench -- and with it, a parade of colleagues. Some came simply to pet it, not caring if it was on or not. Some commented, ""It\'s a lot thicker than I expected,"" which just made me laugh. Only one ignored the shiny, plopped himself in my chair, and essentially said, ""Let\'s see some HDR footage.""\xc2\xa0'b""That, in a nutshell, is part of the brilliance of Apple's marketing. The buzz it's generated among nonprofessionals is vastly disproportionate to the small number of people for whom this display makes real sense: A subset of editors on Mac-only pro video workflows doing 1,000-nit, high-dynamic-range color correction. Mac-based photo pros retouching on high-resolution, broad-tonal-range images (who don't care about Adobe RGB). Illustrators working on designs with complex details. And so on.\xc2\xa0""b""For them, the display's $5,000-plus price tag is likely worth it for the 1,600-nit peak brightness, 6K resolution and hardware calibration profiles for a handful of reference standards and pseudo standards, such as Apple's own P3-D50 color space for design and print, specifically targeted for Mac-only operation. (I won't reiterate the complete specs.)""b'It starts at $5,000.'b""I've only had it for a brief time, so haven't begun my formal measurements or more rigorous hands-on testing. I'm still trying to work out some of the kinks -- and yes, there are some frustrating kinks and drawbacks.\xc2\xa0""b""Our evaluation unit is the cheaper $5,000 (\xc2\xa34,599, AU$8,499) version of the monitor -- the one without the $1,000 (\xc2\xa3900, AU$1,500) Nano-texture glass upgrade. While it's pretty reflective when you're staring at a black screen, under normal working conditions it's not bad as long as you don't have light shining directly at it. But if you do, that's probably a bad work setup no matter what. The XDR is fond of fingerprints, though.""b'Some things just jumped out the first time I fired it up.\xc2\xa0'b""Simply eyeballing, it has some of the best blacks I've seen in a desktop or laptop monitor. And that includes OLED. While OLED can effectively get down to zero black, the Pro Display XDR actually has some usable tonal range in the deep shadows.""b""You will see some haloing around highlights on super dark backgrounds; that's just a fact of life for the zone-based local dimming which makes HDR possible and which tends to be a bigger issue for desktop monitors than TVs. The question is, does the Pro Display have enough zones? The current generation of HDR monitors with similar mini LED backlights, such as the Asus PA32UCG, boast twice as many as the Pro Display XDR's 576.""b""Another pleasant surprise is skin tones. You don't realize how comparatively imprecise generally well-regarded monitors are in comparison -- like the iMac's -- until you pop open some portraits on the Pro Display.""b""It's also very quiet. That's because the back is functional as well as eye catching. It's basically a big heat sink, designed to dissipate the heat coming off the 1,600-nit-capable backlight. The fans only have to cool the circuit board, and blow the air out the grater. And the air coming out is cool. I've used 1,000-nit monitors, and they can generate a lot of heat out the front as well, even when they're not maxed out. Not this one.""b""The 6K resolution (6,016x3,384 pixels) is both a blessing and a curse. If you're editing 6K video, retouching 25-megapixel or bigger images, working on highly detailed illustration and so on, it comes in really handy. But the resolution, along with the HDR, is one of the reasons hardware compatibility is an issue.\xc2\xa0""b'Driving the higher resolution and higher bit depth needed for HDR requires more bandwidth than supplied by DisplayPort 1.4, the monitor protocol used by the current generation of Thunderbolt 3 controllers. So Apple does some voodoo starting with MacOS 10.15.2 Catalina to pump out more data through the port.\xc2\xa0'b""That's not new. Pushing the envelope on monitor resolutions and color depth has always required some alchemy while waiting for system chipsets to catch up. But there are sticking points for some. For instance, if you want to use it with an iMac Pro ($5,000 at Best Buy), you need to get the Blackmagic Design eGPU\xc2\xa0with its Intel Titan Ridge-generation controller because the Thunderbolt controller in the iMac Pro is too old.""b""This isn't for average consumers, it's for media professionals.""b""There are no hardware controls, either, and I really, really miss them. Even something as basic as a power button because sometimes you just want to turn it off. If you're hooked up to an iMac, you can't disable the Pro Display and use only the internal display, or vice versa. Why would you want to? Well, for one, to keep the light from one monitor from seeping into your peripheral vision. Instead, it seems you have to pull the plug or cable.\xc2\xa0""b""Lack of hardware controls is one of the things that makes it impossible to use with Windows except with Boot Camp, which has a software control panel for changing mode presets. Even if you manage to kludge a solution to make it work on a PC or Windows laptop, you're still out of luck. I plugged it into an Nvidia Quadro RTX 5000-equipped laptop and it was ugly.\xc2\xa0""b'I also miss having multiple input sources and connections and being able to switch between them so I can connect a single monitor to multiple systems. Stripping it down to a single Thunderbolt 3-only input seems a bit hostile towards your user base.'b""Normally I'd ding Apple heavily for the limited compatibility, but one thing I've learned over the years is that color management is one of the hardest things in tech to get right. So if it wants to tightly circumscribe the potential customer base, especially for a first-generation product, I'll cut the company some slack. Apple's been burned on monitors before, after all.""b'An extra, official stand for the XDR costs $1,000.'b""Want to kick back and view HDR content on your pretty new monitor that's\xc2\xa0not\xc2\xa0part of Apple TV Plus? Good luck. Streaming 4K HDR from a computer in general is confusing, but the Vega-class AMD graphics chips in the higher-end Macs are the most limited. (They don't support decryption of HDCP 2.2 DRM'd content from Netflix and Amazon.) At least in Windows under Boot Camp you can view YouTube 4K HDR video.\xc2\xa0""b""Even if you have all the hardware and software pieces in place to take full advantage of the display's capabilities, two really important features are still on the roadmap: User reference modes and support for custom calibrations.""b""And, finally: Is the sold-separately stand worth $1,000 (\xc2\xa3949, AU$1,699)? Nope. The fact that the stand matches the screen doesn't compensate for not being able to swivel the monitor, lower it enough to align its center with an iMac display or to lock into a perfectly horizontal position. Although, the latter might not matter too much to you unless you have an almost OCD-like compulsion to adjust anything on the wall that's askew.""b'You want something to play with that glides prettily? Get yourself a fidget spinner and put the Pro Display XDR on an arm or an ugly-but-more-practical stand.\xc2\xa0'b'This review is a work in progress and will be updated as testing continues.\xc2\xa0\xc2\xa0'",N/A,b'Lori Grunin',"Feb. 10, 2020 4:00 a.m. PT"
b'Acer Predator XB272',b'Monitors',CNET,"b""Acer Predator XB272 review:\xc2\xa0It's worth the money if you need the gaming speed""","b""Acer raises the bar for high frame-rate gamers, extending its 25-inch Predator XB252 up to 27 inches and bringing with it a maximum refresh of 240Hz. At $680 (approximately \xc2\xa3620, AU$1,050) It's not the cheapest G-Sync monitor around, but at the moment it's one of the few to refresh that fast. And for a TN panel, it's pretty good.(Don't confuse this with the as-yet-unavailable XB272-HDR, which has a completely different panel.) ""b""The trade-off, though, is resolution, which is also the same as the smaller panel. That means you can drive a truck between the pixels -- OK, not really, but it does mean that for doing things other than playing games it's not very sharp. For games, you can use G-Sync DSR to increase the perceived resolution. ""b""The XB272's layout is pretty typical, with onscreen display controls on the back right. The buttons are a little flat and hard to feel, but they're supplemented by a joystick that makes it much easier to navigate the menus than typical up- and down-arrow buttons. You can map two of the buttons directly to menu options, a nice perk. ""b""It has a reasonably broad set of options. Among the various presets there are three gaming-specific ones that change the brightness, refresh rate and white point settings. There's also a selection of three optional target overlays, adaptive contrast, and a decent set of display options for color and brightness. """,8.0,b'Lori Grunin',"June 26, 2017 4:50 p.m. PT"
